{
  "$schema": "https://json-schema.org/draft/2020-12/schema",
  "$id": "https://github.com/reggiechan74/deep-research-engine-creator/plugin-manifest-schema.json",
  "title": "Claude Code Plugin Manifest",
  "description": "Schema for .claude-plugin/plugin.json files generated by the engine-creator. Validates the structure of plugin manifests for both root and generated plugins.",
  "type": "object",
  "required": ["name", "version", "description"],
  "additionalProperties": true,
  "properties": {
    "name": {
      "type": "string",
      "description": "Plugin name in kebab-case.",
      "pattern": "^[a-z0-9]+(-[a-z0-9]+)*$"
    },
    "version": {
      "type": "string",
      "description": "Semantic version of the plugin.",
      "pattern": "^\\d+\\.\\d+\\.\\d+$"
    },
    "description": {
      "type": "string",
      "description": "Short description of what the plugin does."
    },
    "author": {
      "type": "object",
      "description": "Author information. Email is optional and should only be included if a valid email is available.",
      "properties": {
        "name": { "type": "string" },
        "email": { "type": "string", "format": "email" }
      },
      "additionalProperties": false
    },
    "keywords": {
      "type": "array",
      "description": "Keywords for discoverability.",
      "items": { "type": "string" }
    },
    "license": {
      "type": "string",
      "description": "SPDX license identifier.",
      "examples": ["MIT", "Apache-2.0"]
    }
  }
}
